<?xml version="1.0" encoding="UTF-8"?>
<sauvegarde xmlns="http://www.univ-grenoble-alpes.fr/l3miage/dodgeblock"
            xmlns:xsi="http://www.w3.org/2001/XMLSchema-instance"
            xsi:schemaLocation="http://www.univ-grenoble-alpes.fr/l3miage/dodgeblock  ../xsd/sauvegarde.xsd">

    <general>
        <score>50</score>
        <saveDate>2024-11-29</saveDate>
        <difficultyLevel>1</difficultyLevel>
    </general>

    <player>
        <position>
            <X>500</X>
            <Y>300</Y>
        </position>
    </player>

    <etat-partie>
        <blocks>
            <block>
                <position>
                    <X>7</X>
                    <Y>12</Y>
                </position>
                <speed>2</speed>
            </block>
            <block>
                <position>
                    <X>6</X>
                    <Y>8</Y>
                </position>
                <speed>4</speed>
            </block>
        </blocks>
        <pouvoirs>
            <pouvoir>
                <type>Shield</type>
                <duree>10</duree>
            </pouvoir>
            <pouvoir>
                <type>DoubleScore</type>
                <duree>5</duree>
            </pouvoir>
        </pouvoirs>
    </etat-partie>

</sauvegarde>